<!ENTITY pub "TechBooks Publishing Ltd.">

<!ELEMENT library (book+)>
<!ELEMENT book (title, author, price, publisher)>
<!ATTLIST book id ID #REQUIRED>

<!ELEMENT title (#PCDATA)>
<!ELEMENT author (#PCDATA)>
<!ELEMENT price (#PCDATA)>
<!ELEMENT publisher (#PCDATA)>
